<?xml version="1.0" encoding="UTF-8"?>
<!--Sample XML file generated by XMLSpy v2009 (http://www.altova.com)-->
<?xml-stylesheet type="text/xsl" href="contract.xsl"?>
<contract xmlns:xsi="http://www.w3.org/2001/XMLSchema-instance" xsi:noNamespaceSchemaLocation="contract.xsd">
	<Title>PMC</Title>
	<contractURL>PMCContract.html</contractURL>
	<Total>100000</Total>
	<Currency>
		<currencyName>PMC</currencyName>
		<currencyLongName>PIMECO Community Currency issue and participations </currencyLongName>
		<currencyLogo>images/pmc.jpg</currencyLogo>
	</Currency>
	<ValidPeriod>
		<start>2012-02-21T00:00:00</start>
		<end>2013-02-21T00:00:00</end>
		<issueDate>2012-01-01</issueDate>
	</ValidPeriod>
	<contractEan13Number>536005160012</contractEan13Number>
	<Definitions name="circunscription">INSULA is the DESPERADOS association in the COUNTRY</Definitions>
	<Definitions name="representation">The LEGAL ISSUER represents the COLLECTORS at the INSULA</Definitions>
	<Definitions name="affiliation">COLLECTORS are affiliated companies to the LEGAL ISSUER</Definitions>
	<Definitions name="authorization">LEGAL ISSUER is the authorised institution by the INSULA to issue money in the denominations indicated in CURRENCY</Definitions>
	<Definitions name="holder">HOLDER of this voucher is any Citizen, identified by the INSULA REGISTRATION ID, in possession of money of CURRENCY in paper of electronic format</Definitions>
	<Conditions name="amounts">LEGAL ISSUER will issue money in CURRENCY for a total amount at equivalent of all the MERCHANDISES to be available for trade with CURRENCY during the VALID PERIOD</Conditions>
	<Conditions name="prices">COLLECTORS will indicate the prices of the MERCHANDISES included in this contract in CURRENCY on top of legal tender prices</Conditions>
	<Conditions name="price guarantee">COLLECTORS will not chage the prices in CURRENCY from the date of the issue, until the end of the valid period</Conditions>
	<Conditions name="redemption">COLLECTORS commit to redeem the money in CURRENCY of any INSULA HOLDER for MERCHANDISES worth the price in CURRENCY</Conditions>
	<Conditions name="optional redemption">Optionally, COLLECTORS may redeem CURRENCY of non INSULA HOLDERS the same way</Conditions>
	<Insula>
		<name>DRY-M</name>
		<long_name>Democracia Real Ya Mallorca</long_name>
		<address>na</address>
		<country>ES53</country>
		<email>mallorca@democraciarealya.es</email>
		<url>http://mallorca.democraciarealya.es/</url>
		<logo>images/dry.jpg</logo>
		<citizensID>ES530000000</citizensID>
		<BitCoinAddress QR="" privateKey="text">1LexGaCh4oYcZvMZKAWDTRbG4G4fcnCQCS</BitCoinAddress>
	</Insula>
	<legalIssuer>
		<number>ES53PMCY2012</number>
		<holder kind="account">
			<name>PIMECO</name>
			<long_name>Associaci√≥ del Petit i Mitja Comerc de Mallorca</long_name>
			<address>C/Patronato Obrero, 14 B bajos, 07006 Palma</address>
			<country>ES53</country>
			<email>pimeco@pimeco.com</email>
			<url>http://www.pimeco.com/inicio/</url>
			<logo>images/pimeco.jpg</logo>
			<citizensID>ES530005631</citizensID>
			<BitCoinAddress QR="" privateKey="text">19KTQ8we2N6jrm7x3umpdeVmPWrQ4ibHLf</BitCoinAddress>
		</holder>
		<share>
			<percent>100</percent>
			<resultingFixed>100000</resultingFixed>
		</share>
		<participation>
			<number>ES53PMCY2012ACCN01</number>
			<holder kind="account">
				<name>Jesus ANTOLIN</name>
				<country>ES53</country>
				<citizensID>ES530005000</citizensID>
				<BitCoinAddress>1LRu7zAuCymJMxLe7W6fTVtJY9y9aLjq9w</BitCoinAddress>
			</holder>
			<share>
				<percent>0.66784</percent>
				<resultingFixed>667.84</resultingFixed>
			</share>
					<participation>
			<number>ES53PMCY2012ACCN01S1</number>
			<holder kind="account">
				<name>Jesus ANTOLIN</name>
				<country>ES53</country>
				<citizensID>ES530005000</citizensID>
				<BitCoinAddress>1LRu7zAuCymJMxLe7W6fTVtJY9y9aLjq9w</BitCoinAddress>
			</holder>
			<share>
				<percent>80</percent>
				<resultingFixed>534.272</resultingFixed>
			</share>
			</participation>
			<participation>
				<number>ES53PMCY2012ACCN01S2</number>
				<holder kind="account">
					<name>Jose Maria ARCA</name>
					<country>ES53</country>
					<citizensID>ES530005001</citizensID>
					<BitCoinAddress>1KzcqsmqcBXGoWzAJY4MXHAYc3MozUKaUa</BitCoinAddress>
				</holder>
				<share>
					<percent>10</percent>
					<resultingFixed>66.784</resultingFixed>
				</share>
			</participation>
			<participation>
				<number>ES53PMCY2012ACCN01S3</number>
				<holder kind="account">
					<name>Catalina ARELLANO</name>
					<country>ES53</country>
					<citizensID>ES530005002</citizensID>
					<BitCoinAddress>1EicQKF7vrF5HRHiqhJYybW3QfG9pUSgBT</BitCoinAddress>
				</holder>
				<share>
					<percent>10</percent>
					<resultingFixed>66.784</resultingFixed>
				</share>
							<participation>
				<number>ES53PMCY2012ACCN01S31</number>
				<holder kind="account">
					<name>Catalina ARELLANO</name>
					<country>ES53</country>
					<citizensID>ES530005002</citizensID>
					<BitCoinAddress>1EicQKF7vrF5HRHiqhJYybW3QfG9pUSgBT</BitCoinAddress>
				</holder>
				<share>
					<percent>90</percent>
					<resultingFixed>60.1056</resultingFixed>
				</share>
				</participation>
				<participation>
			<number>ES53PMCY2012ACCN01S32</number>
			<holder kind="account">
				<name>Amayra ARGILES</name>
				<country>ES53</country>
				<citizensID>ES530005003</citizensID>
				<BitCoinAddress>12HmKDtLXDZiYE59hbQZFk65JxoJdoqWaC</BitCoinAddress>
			</holder>
			<share>
				<percent>10</percent>
				<resultingFixed>6.6784</resultingFixed>
			</share>
		</participation>
			</participation>
		</participation>
		<participation>
			<number>ES53PMCY2012ACCN02</number>
			<holder kind="account">
				<name>Jose Maria ARCA</name>
				<country>ES53</country>
				<citizensID>ES530005001</citizensID>
				<BitCoinAddress>1KzcqsmqcBXGoWzAJY4MXHAYc3MozUKaUa</BitCoinAddress>
			</holder>
			<share>
				<percent>0.3389</percent>
				<resultingFixed>338.9</resultingFixed>
			</share>
		</participation>
		<participation>
			<number>ES53PMCY2012ACCN03</number>
			<holder kind="account">
				<name>Catalina ARELLANO</name>
				<country>ES53</country>
				<citizensID>ES530005002</citizensID>
				<BitCoinAddress>1EicQKF7vrF5HRHiqhJYybW3QfG9pUSgBT</BitCoinAddress>
			</holder>
			<share>
				<percent>0.69969</percent>
				<resultingFixed>699.69</resultingFixed>
			</share>
		</participation>
		<participation>
			<number>ES53PMCY2012ACCN04</number>
			<holder kind="account">
				<name>Amayra ARGILES</name>
				<country>ES53</country>
				<citizensID>ES530005003</citizensID>
				<BitCoinAddress>12HmKDtLXDZiYE59hbQZFk65JxoJdoqWaC</BitCoinAddress>
			</holder>
			<share>
				<percent>0.5019</percent>
				<resultingFixed>501.9</resultingFixed>
			</share>
		</participation>
		<participation>
			<number>ES53PMCY2012ACCN05</number>
			<holder kind="account">
				<name>Javier ARRAYAS</name>
				<country>ES53</country>
				<citizensID>ES530005004</citizensID>
				<BitCoinAddress>15FDmrjyC1ueWs8rpyKHGTRdsi5CuCZr2o</BitCoinAddress>
			</holder>
			<share>
				<percent>0.08689</percent>
				<resultingFixed>86.89</resultingFixed>
			</share>
		</participation>
		<participation>
			<number>ES53PMCY2012ACCN06</number>
			<holder kind="account">
				<name>Enrique ARRIBAS</name>
				<country>ES53</country>
				<citizensID>ES530005005</citizensID>
				<BitCoinAddress>1NihXuUVFMizSNRfwcfVnVsRVvbaW5nzQU</BitCoinAddress>
			</holder>
			<share>
				<percent>0.02133</percent>
				<resultingFixed>21.33</resultingFixed>
			</share>
		</participation>
		<participation>
			<number>ES53PMCY2012ACCN07</number>
			<holder kind="account">
				<name>Carballas AVILA</name>
				<country>ES53</country>
				<citizensID>ES530005006</citizensID>
				<BitCoinAddress>1CFMiB87p4g1qdHxhkuH1JTkeL2Rdxtk6B</BitCoinAddress>
			</holder>
			<share>
				<percent>0.34315</percent>
				<resultingFixed>343.15</resultingFixed>
			</share>
		</participation>
		<participation>
			<number>ES53PMCY2012ACCN08</number>
			<holder kind="account">
				<name>Matias AYALA</name>
				<country>ES53</country>
				<citizensID>ES530005007</citizensID>
				<BitCoinAddress>1A5Das6axLmV6tFZ3WELogEqZrEwjJ4pJC</BitCoinAddress>
			</holder>
			<share>
				<percent>0.48316</percent>
				<resultingFixed>483.16</resultingFixed>
			</share>
		</participation>
		<participation>
			<number>ES53PMCY2012ACCN09</number>
			<holder kind="account">
				<name>Fidel AZPIROZ</name>
				<country>ES53</country>
				<citizensID>ES530005008</citizensID>
				<BitCoinAddress>19DEcLLi4PNvb7dvsSGRYwWoJNGXe5hmBj</BitCoinAddress>
			</holder>
			<share>
				<percent>0.7665</percent>
				<resultingFixed>766.5</resultingFixed>
			</share>
		</participation>
		<participation>
			<number>ES53PMCY2012ACCN10</number>
			<holder kind="account">
				<name>Jose Joaquin BALANA</name>
				<country>ES53</country>
				<citizensID>ES530005009</citizensID>
				<BitCoinAddress>1NU4Tyn1ffk58X37fXaN4qsWJ4yqFfSkCD</BitCoinAddress>
			</holder>
			<share>
				<percent>0.39236</percent>
				<resultingFixed>392.36</resultingFixed>
			</share>
		</participation>
		<participation>
			<number>ES53PMCY2012ACCN11</number>
			<holder kind="account">
				<name>Francisco Jose BASTIDA</name>
				<country>ES53</country>
				<citizensID>ES530005010</citizensID>
				<BitCoinAddress>1BRDnJEaTPRGGsMKcM6e7ynVTUFvuTqktD</BitCoinAddress>
			</holder>
			<share>
				<percent>0.52546</percent>
				<resultingFixed>525.46</resultingFixed>
			</share>
		</participation>
		<participation>
			<number>ES53PMCY2012ACCN12</number>
			<holder kind="account">
				<name>Ramon BELLOQUE</name>
				<country>ES53</country>
				<citizensID>ES530005011</citizensID>
				<BitCoinAddress>1DGsKNbCciPiaouJcfyfd5RRZyv7JysrPT</BitCoinAddress>
			</holder>
			<share>
				<percent>0.75604</percent>
				<resultingFixed>756.04</resultingFixed>
			</share>
		</participation>
		<participation>
			<number>ES53PMCY2012ACCN13</number>
			<holder kind="account">